{
  "$schema": "https://json-schema.org/draft/2020-12/schema",
  "$id": "audit-request.schema.json",
  "title": "AuditRequest",
  "description": "Body of one evidence-consistency audit request, schema 0.0.1. This is the JSON body only. HTTP path, method, and auth are out of scope. label and score are display-only and must not be audited.",
  "type": "object",
  "required": ["schema_version", "transcript", "assessment"],
  "additionalProperties": false,
  "properties": {
    "schema_version": {
      "const": "0.0.1",
      "description": "Contract version. Producers must send exactly this value until the contract is bumped."
    },
    "request_id": {
      "type": "string",
      "minLength": 1,
      "description": "Caller-chosen id. If present, the response must echo it unchanged. Not a content hash."
    },
    "transcript": {
      "type": "array",
      "minItems": 1,
      "description": "Interview turns in order. Evidence spans use this array's index, not turn.id.",
      "items": { "$ref": "#/$defs/Turn" }
    },
    "assessment": {
      "type": "array",
      "minItems": 1,
      "description": "Clinician reasoning, split only for display. A single section is valid. Claim spans use this array's index, not section.id.",
      "items": { "$ref": "#/$defs/Section" }
    }
  },
  "$defs": {
    "Turn": {
      "type": "object",
      "required": ["id", "text"],
      "additionalProperties": false,
      "properties": {
        "id": {
          "type": "string",
          "minLength": 1,
          "description": "Stable id for logs only. The response must not point at this id."
        },
        "speaker": {
          "type": "string",
          "minLength": 1,
          "description": "Optional speaker identity. Missing means unknown; never infer it. Free text, for example clinician1, patient1, caretaker1, or any custom name. Each distinct string is a distinct speaker. There is no limit on how many."
        },
        "role": {
          "enum": ["interviewer", "respondent", "informant", "other"],
          "description": "Optional coarse class. speaker carries the custom name. Do not invent a role that was not supplied."
        },
        "text": {
          "type": "string",
          "description": "Turn text. May be empty. Character offsets count Unicode code points in this string."
        },
        "timestamp": {
          "type": "string",
          "minLength": 1,
          "description": "Shown exactly as supplied. Never inferred. The response must not copy this value."
        }
      }
    },
    "Section": {
      "type": "object",
      "required": ["id", "text"],
      "additionalProperties": false,
      "properties": {
        "id": {
          "type": "string",
          "minLength": 1,
          "description": "Stable id for logs only. Claim spans use the array index, not this id."
        },
        "label": {
          "type": "string",
          "minLength": 1,
          "description": "Domain or sub-domain name, for example Inattention. Display and grouping only. Never audited."
        },
        "score": {
          "type": ["number", "string"],
          "description": "Rater score for this section. Display only. Never audited, never recalculated."
        },
        "text": {
          "type": "string",
          "minLength": 1,
          "description": "The clinician's reasoning for this section. Claim character offsets count Unicode code points in this string."
        }
      }
    }
  }
}
