{
 "schema_version": "0.0.1",
 "request_id": "adhd-v4-noroles",
 "transcript": [
  {
   "id": "t0",
   "speaker": "clinician1",
   "text": "Thanks for coming in. I'll ask about attention, first now as an adult, then as a child. Do you often have trouble keeping your attention on tasks at work?"
  },
  {
   "id": "t1",
   "speaker": "alex1",
   "text": "Yeah, in meetings especially. If it goes past twenty minutes I'm gone, I'm thinking about something else."
  },
  {
   "id": "t2",
   "speaker": "clinician1",
   "text": "How often does that happen?"
  },
  {
   "id": "t3",
   "speaker": "alex1",
   "text": "Most meetings. So three or four times a week."
  },
  {
   "id": "t4",
   "speaker": "clinician1",
   "text": "Do you make careless mistakes in your work, like in emails or reports?"
  },
  {
   "id": "t5",
   "speaker": "alex1",
   "text": "Not really. My manager actually says my reports are pretty clean. I double-check everything."
  },
  {
   "id": "t6",
   "speaker": "clinician1",
   "text": "Do you often lose things you need, like keys, phone, wallet?"
  },
  {
   "id": "t7",
   "speaker": "alex1",
   "text": "My phone, constantly. Probably every day I'm hunting for it."
  },
  {
   "id": "t8",
   "speaker": "clinician1",
   "text": "And keys?"
  },
  {
   "id": "t9",
   "speaker": "alex1",
   "text": "Keys, no. I have a hook by the door. That one I solved."
  },
  {
   "id": "t10",
   "speaker": "clinician1",
   "text": "Do you have trouble finishing tasks, like household projects?"
  },
  {
   "id": "t11",
   "speaker": "alex1",
   "text": "Sometimes. I've got a half-painted bathroom right now. Actually, it's been like that a month mostly because we ran out of paint."
  },
  {
   "id": "t12",
   "speaker": "clinician1",
   "text": "Are you easily distracted by things going on around you?"
  },
  {
   "id": "t13",
   "speaker": "alex1",
   "text": "Hm."
  },
  {
   "id": "t14",
   "speaker": "clinician1",
   "text": "Let's go back to childhood, ages five to twelve. Did teachers comment on your attention?"
  },
  {
   "id": "t15",
   "speaker": "alex1",
   "text": "Oh, constantly. Every report card said \"daydreams\" or \"doesn't finish work.\""
  },
  {
   "id": "t16",
   "speaker": "clinician1",
   "text": "Did you have trouble with homework?"
  },
  {
   "id": "t17",
   "speaker": "alex1",
   "text": "I'd forget it at home maybe once a week. That stopped by high school."
  },
  {
   "id": "t18",
   "speaker": "clinician1",
   "text": "Sam, you've lived with Alex for six years. What do you notice?"
  },
  {
   "id": "t19",
   "speaker": "sam1",
   "text": "He forgets things we've agreed on. I'll ask him to pick up groceries and he comes home without them, maybe twice a month."
  },
  {
   "id": "t20",
   "speaker": "clinician1",
   "text": "Anything else?"
  },
  {
   "id": "t21",
   "speaker": "sam1",
   "text": "Honestly, I'm the forgetful one with appointments. I rely on his calendar. He's good with appointments."
  },
  {
   "id": "t22",
   "speaker": "clinician1",
   "text": "Alex, do you agree about the groceries?"
  },
  {
   "id": "t23",
   "speaker": "alex1",
   "text": "I think it's less than that. Maybe once a month, if that."
  },
  {
   "id": "t24",
   "speaker": "clinician1",
   "text": "Is any of this causing problems at work?"
  },
  {
   "id": "t25",
   "speaker": "alex1",
   "text": "I got a comment in my review about seeming checked out in meetings. That's it. I wasn't written up or anything."
  }
 ],
 "assessment": [
  {
   "id": "s1",
   "label": "Inattention (DSM-5 A1)",
   "score": "5/9",
   "text": "Alex reports losing attention in most meetings, about three to four times a week. He reports misplacing his phone daily but has a system for keys. He describes some difficulty finishing household projects, although the current unfinished project is partly because they ran out of paint. His partner reports he forgets agreed errands about twice a month; Alex estimates once a month. Childhood report cards repeatedly noted daydreaming and unfinished work. He received a review comment about seeming disengaged in meetings. He denies careless mistakes at work. He is easily distracted by his surroundings."
  }
 ]
}
